<!ENTITY kop "Adressenlijst van JeanLouis Van der Auwermeulen">
<!ELEMENT adressen (title,adres+)>
<!ELEMENT title (#PCDATA)>
    <!ELEMENT adres (naam,voornaam+,straat-nummer?,plaats,(telefoon-nummer|gsm-nummer),email?)>
        <!ELEMENT naam (#PCDATA)>
        <!ELEMENT voornaam (#PCDATA)>
        <!ELEMENT straat-nummer (#PCDATA)>
        <!ELEMENT plaats (#PCDATA)>
        <!ELEMENT telefoon-nummer (#PCDATA)>
        <!ELEMENT gsm-nummer (#PCDATA)>
        <!ELEMENT email (#PCDATA)>